{
  "$schema": "https://json-schema.org/draft/2020-12/schema",
  "$id": "https://github.com/sprimault/ormeau/schemas/calque-physique.v2.json",
  "title": "Calque physique",
  "description": "Décalque fidèle du catalogue d'une base relationnelle. Aucune interprétation, aucun renommage. Doit contenir tout ce qui est nécessaire pour reconstruire un DDL équivalent.",
  "type": "object",
  "required": ["version_ri", "source", "tables"],
  "additionalProperties": false,
  "properties": {
    "version_ri": { "type": "integer", "const": 2 },
    "source": { "$ref": "#/$defs/source" },
    "tables": { "type": "array", "items": { "$ref": "#/$defs/table" } },
    "sequences": { "type": "array", "items": { "$ref": "#/$defs/sequence" } },
    "types_enumeres": { "type": "array", "items": { "$ref": "#/$defs/typeEnumere" } },
    "vues": { "type": "array", "items": { "$ref": "#/$defs/vue" } },
    "statistiques": {
      "description": "Optionnel, produit uniquement avec --echantillonner. Clé : schema.table.",
      "type": "object",
      "additionalProperties": { "$ref": "#/$defs/statistiquesTable" }
    }
  },
  "$defs": {
    "source": {
      "type": "object",
      "description": "Pas de schéma : chaque table, vue, séquence et type énuméré porte le sien. La version 1 en nommait un seul, faux dès qu'une extraction en couvrait plusieurs.",
      "required": ["sgbd", "version", "catalogue", "extrait_le", "empreinte"],
      "additionalProperties": false,
      "properties": {
        "sgbd": { "enum": ["postgres", "mysql", "mariadb", "sqlserver", "sqlite", "oracle"] },
        "version": { "type": "string" },
        "catalogue": { "type": "string" },
        "extrait_le": {
          "description": "Isolé ici et exclu de l'empreinte, pour que deux extractions identiques produisent la même empreinte.",
          "type": "string",
          "format": "date-time"
        },
        "empreinte": {
          "description": "sha256 du document sérialisé, source.extrait_le et source.empreinte exclus.",
          "type": "string",
          "pattern": "^sha256:[0-9a-f]{64}$"
        }
      }
    },
    "table": {
      "type": "object",
      "required": ["nom", "schema", "colonnes"],
      "additionalProperties": false,
      "properties": {
        "nom": { "type": "string" },
        "schema": { "type": "string" },
        "commentaire": { "type": "string" },
        "colonnes": { "type": "array", "minItems": 1, "items": { "$ref": "#/$defs/colonne" } },
        "cle_primaire": { "$ref": "#/$defs/clePrimaire" },
        "cles_etrangeres": { "type": "array", "items": { "$ref": "#/$defs/cleEtrangere" } },
        "unicites": { "type": "array", "items": { "$ref": "#/$defs/contrainteColonnes" } },
        "index": {
          "description": "Sans l'index qui soutient une contrainte d'unicité ou la clé primaire : la contrainte le dit déjà. Une version 1 reportait celui d'une unicité ; il est retiré à la lecture.",
          "type": "array", "items": { "$ref": "#/$defs/index" }
        },
        "verifications": { "type": "array", "items": { "$ref": "#/$defs/verification" } },
        "options": { "$ref": "#/$defs/optionsTable" }
      }
    },
    "colonne": {
      "type": "object",
      "required": ["nom", "position", "type_brut", "type_normalise", "nullable"],
      "additionalProperties": false,
      "properties": {
        "nom": { "type": "string" },
        "position": { "type": "integer", "minimum": 1 },
        "type_brut": {
          "description": "Verbatim du catalogue, jamais reconstruit à partir des composants.",
          "type": "string"
        },
        "type_normalise": { "$ref": "#/$defs/typeNormalise" },
        "longueur": { "type": "integer", "minimum": 0 },
        "longueur_fixe": {
          "description": "La base complète les valeurs jusqu'à la longueur déclarée (character(n), char, nchar, binary). Lu par chaque pilote dans son catalogue. Absent d'un calque extrait avant ce champ : inconnu.",
          "type": "boolean"
        },
        "fuseau": {
          "description": "L'horodatage ou l'heure porte son décalage (timestamptz, timetz, datetimeoffset). Lu par chaque pilote dans son catalogue. Absent d'un calque extrait avant ce champ : inconnu.",
          "type": "boolean"
        },
        "precision_fractionnaire": {
          "description": "Nombre de décimales des secondes d'un horodatage ou d'une heure, tel que la colonne le déclare. Absent quand le type n'en déclare pas, ou d'un calque extrait avant ce champ.",
          "type": "integer",
          "minimum": 0
        },
        "precision": { "type": "integer", "minimum": 0 },
        "echelle": { "type": "integer" },
        "nullable": { "type": "boolean" },
        "auto_increment": { "type": "boolean" },
        "identite": {
          "description": "Nature d'une colonne dont la base produit la valeur, présente seulement avec auto_increment. toujours : une valeur explicite est refusée sans option de session (PostgreSQL GENERATED ALWAYS, SQL Server IDENTITY) ; par_defaut : elle est acceptée (PostgreSQL GENERATED BY DEFAULT, MySQL AUTO_INCREMENT). Absente d'un calque extrait avant ce champ : nature inconnue.",
          "enum": ["toujours", "par_defaut"]
        },
        "defaut": { "$ref": "#/$defs/defaut" },
        "generee": { "$ref": "#/$defs/generee" },
        "collation": {
          "description": "Nom de la collation, non cité ; default pour la collation par défaut de la base.",
          "type": "string"
        },
        "collation_schema": {
          "description": "Schéma de la collation, présent seulement hors de pg_catalog : sous un search_path vide, tout le reste se résout sans chemin. Absent d'un calque extrait avant ce champ : schéma inconnu.",
          "type": "string"
        },
        "type_enumere": {
          "description": "Nom d'une entrée de types_enumeres, pour les SGBD à types énumérés natifs.",
          "type": "string"
        },
        "commentaire": { "type": "string" }
      },
      "dependentSchemas": {
        "identite": {
          "required": ["auto_increment"],
          "properties": { "auto_increment": { "const": true } }
        }
      }
    },
    "typeNormalise": {
      "description": "Vocabulaire fermé. Toute valeur ajoutée incrémente version_ri.",
      "enum": [
        "entier",
        "decimal",
        "flottant",
        "texte",
        "binaire",
        "booleen",
        "date",
        "heure",
        "horodatage",
        "intervalle",
        "uuid",
        "json",
        "xml",
        "geometrie",
        "enumere",
        "reseau",
        "inconnu"
      ]
    },
    "defaut": {
      "description": "Structuré, jamais une chaîne nue : sinon DEFAULT 'now()' et DEFAULT now() sont indistinguables.",
      "type": "object",
      "required": ["genre", "valeur"],
      "additionalProperties": false,
      "properties": {
        "genre": { "enum": ["litteral", "expression", "sequence"] },
        "valeur": { "type": "string" },
        "sequence": {
          "description": "Séquence que tire un défaut de genre sequence, lue dans les dépendances du catalogue, nom non cité. Absente quand le catalogue n'en désigne pas une seule, ou d'un calque extrait avant ce champ.",
          "type": "object",
          "required": ["schema", "nom"],
          "additionalProperties": false,
          "properties": {
            "schema": { "type": "string" },
            "nom": { "type": "string" }
          }
        }
      }
    },
    "generee": {
      "type": "object",
      "required": ["expression", "stockee"],
      "additionalProperties": false,
      "properties": {
        "expression": { "type": "string" },
        "stockee": { "type": "boolean" }
      }
    },
    "clePrimaire": {
      "type": "object",
      "required": ["colonnes"],
      "additionalProperties": false,
      "properties": {
        "nom": { "type": "string" },
        "colonnes": { "type": "array", "minItems": 1, "items": { "type": "string" } }
      }
    },
    "cleEtrangere": {
      "type": "object",
      "required": ["colonnes", "table_cible", "schema_cible", "colonnes_cibles"],
      "additionalProperties": false,
      "properties": {
        "nom": { "type": "string" },
        "colonnes": { "type": "array", "minItems": 1, "items": { "type": "string" } },
        "table_cible": { "type": "string" },
        "schema_cible": { "type": "string" },
        "colonnes_cibles": { "type": "array", "minItems": 1, "items": { "type": "string" } },
        "a_la_suppression": { "$ref": "#/$defs/actionReferentielle" },
        "a_la_mise_a_jour": { "$ref": "#/$defs/actionReferentielle" }
      }
    },
    "actionReferentielle": {
      "enum": ["aucune", "cascade", "set_null", "set_default", "restrict"]
    },
    "contrainteColonnes": {
      "type": "object",
      "required": ["colonnes"],
      "additionalProperties": false,
      "properties": {
        "nom": { "type": "string" },
        "colonnes": { "type": "array", "minItems": 1, "items": { "type": "string" } }
      }
    },
    "index": {
      "type": "object",
      "required": ["colonnes", "unique"],
      "additionalProperties": false,
      "properties": {
        "nom": { "type": "string" },
        "colonnes": { "type": "array", "minItems": 1, "items": { "type": "string" } },
        "unique": { "type": "boolean" },
        "predicat": {
          "description": "Index partiel. Verbatim.",
          "type": "string"
        },
        "methode": { "type": "string" },
        "operateurs": {
          "description": "Classe d'opérateurs de chaque colonne, dans le même ordre. Absent quand toutes sont celles par défaut, complet sinon. Sans lui, deux index HNSW de distances différentes sont indistinguables.",
          "type": "array",
          "items": { "type": "string" }
        },
        "ordres": {
          "description": "Sens de tri de chaque colonne, dans le même ordre. Absent quand toutes sont ascendantes, complet sinon. Absent d'un calque extrait par un pilote qui ne le lit pas : sens inconnu.",
          "type": "array",
          "items": { "enum": ["asc", "desc"] }
        }
      }
    },
    "verification": {
      "type": "object",
      "required": ["expression"],
      "additionalProperties": false,
      "properties": {
        "nom": { "type": "string" },
        "expression": { "type": "string" }
      }
    },
    "optionsTable": {
      "type": "object",
      "additionalProperties": false,
      "properties": {
        "moteur": { "type": "string" },
        "collation": { "type": "string" }
      }
    },
    "sequence": {
      "type": "object",
      "required": ["nom", "schema"],
      "additionalProperties": false,
      "properties": {
        "nom": { "type": "string" },
        "schema": { "type": "string" },
        "increment": { "type": "integer" },
        "depart": {
          "description": "Première valeur rendue, que le minimum ne dit pas. Absent d'un calque extrait par un pilote qui ne le lit pas : valeur inconnue, pas 1.",
          "type": "integer"
        },
        "minimum": { "type": "integer" },
        "maximum": { "type": "integer" },
        "cyclique": { "type": "boolean" }
      }
    },
    "typeEnumere": {
      "type": "object",
      "required": ["nom", "schema", "valeurs"],
      "additionalProperties": false,
      "properties": {
        "nom": { "type": "string" },
        "schema": { "type": "string" },
        "valeurs": { "type": "array", "items": { "type": "string" } }
      }
    },
    "vue": {
      "type": "object",
      "required": ["nom", "schema", "definition", "materialisee"],
      "additionalProperties": false,
      "properties": {
        "nom": { "type": "string" },
        "schema": { "type": "string" },
        "definition": { "type": "string" },
        "materialisee": { "type": "boolean" },
        "colonnes": { "type": "array", "items": { "$ref": "#/$defs/colonne" } }
      }
    },
    "statistiquesTable": {
      "type": "object",
      "additionalProperties": false,
      "properties": {
        "lignes_estimees": { "type": "integer", "minimum": 0 },
        "colonnes": {
          "type": "object",
          "additionalProperties": { "$ref": "#/$defs/statistiquesColonne" }
        }
      }
    },
    "statistiquesColonne": {
      "type": "object",
      "additionalProperties": false,
      "properties": {
        "distinctes": { "type": "integer", "minimum": 0 },
        "nuls": { "type": "integer", "minimum": 0 },
        "echantillon": {
          "description": "Valeurs distinctes, uniquement sous le plafond de cardinalité configuré. Jamais de donnée métier au-delà.",
          "type": "array",
          "items": { "type": "string" }
        }
      }
    }
  }
}
